{
  "$schema": "schema/requirements-v2.schema.json",
  "schema_version": 1,
  "schema_sha256": "68bd35838d8008d651c66e5616ae40ed8992f10272b477293e733f30142dd721",
  "registry_kind": "openttd-rl-v2-project-requirements",
  "scope": "V2-M14-through-M23",
  "source_authorities": [
    {"id": "v2-goal", "path": "GOAL.md", "role": "User-authorized V2 scope, autonomy and completion authority."},
    {"id": "v2-research", "path": "docs/project/V2_RESEARCH.md", "role": "Source-backed feature, map and opponent research boundary."},
    {"id": "v2-baseline", "path": "config/v2/research-baseline.json", "role": "Machine feature, command, map, source and opponent inventory."},
    {"id": "v2-settings", "path": "config/v2/setting-inventory.json", "role": "Pinned-source inventory and disposition of every OpenTTD 15.3 setting definition."},
    {"id": "v2-plan", "path": "docs/project/V2_PLAN.md", "role": "Sequential milestones, gates and V2 definition of done."},
    {"id": "v2-m15", "path": "config/v2/m15-scalable-contract.json", "role": "Frozen scalable scenario, resource, observation, action and policy implementation target."},
    {"id": "v1-registry", "path": "docs/project/requirements-v1.json", "role": "Frozen V1 behavior and correctness floor inherited by V2."}
  ],
  "gate_order": ["G14", "G15", "G16", "G17", "G18", "G19", "G20", "G21", "G22", "G23"],
  "requirements": [
    {"id":"V2-AUTH-001","mandatory":true,"milestone":"M14","gate":"G14","status":"PASS","summary":"V2 has an active user-authorized goal, source-backed research report and milestone plan.","acceptance":"Goal, research, plan and navigation documents agree that V2 is active and V1 remains released.","source_refs":["v2-goal","v2-research","v2-plan"],"depends_on":[],"implementation":["GOAL.md","docs/project/V2_RESEARCH.md","docs/project/V2_PLAN.md"],"test_ids":["V2-TEST-M14-RESEARCH"],"evidence":["docs/project/V2_RESEARCH.md","docs/project/V2_PLAN.md"]},
    {"id":"V2-AUTH-002","mandatory":true,"milestone":"M14","gate":"G14","status":"PASS","summary":"Every executable command in pinned OpenTTD 15.3 is inventoried exactly once.","acceptance":"Pinned-source extraction and mutation tests reject omissions, duplicates, unknown commands and sentinel drift.","source_refs":["v2-baseline","v1-registry"],"depends_on":["V2-AUTH-001"],"implementation":["config/v2/research-baseline.json","scripts/v2/validate_research_baseline.py"],"test_ids":["V2-TEST-M14-RESEARCH"],"evidence":["config/v2/research-baseline.json"]},
    {"id":"V2-AUTH-003","mandatory":true,"milestone":"M14","gate":"G14","status":"PASS","summary":"Base-game features, settings, native map sizes and external-AI candidates have machine dispositions.","acceptance":"Feature domains, all 49 rectangles, ten AI identities and all 435 pinned-source setting definitions validate fail closed.","source_refs":["v2-research","v2-baseline","v2-settings"],"depends_on":["V2-AUTH-001"],"implementation":["config/v2/research-baseline.json","scripts/v2/validate_research_baseline.py","config/v2/setting-inventory.json","scripts/v2/generate_setting_inventory.py","scripts/v2/validate_setting_inventory.py"],"test_ids":["V2-TEST-M14-RESEARCH","V2-TEST-M14-SETTINGS"],"evidence":["docs/project/V2_RESEARCH.md","config/v2/research-baseline.json","config/v2/setting-inventory.json","docs/project/M14_INVENTORY_AND_COMPETITION.md"]},
    {"id":"V2-AUTH-004","mandatory":true,"milestone":"M14","gate":"G14","status":"PASS","summary":"V2 has an accepted measured decision to retain or rebase the engine source.","acceptance":"Decision pins both comparison identities, patch-forward result, API drift, consequences and reversal rule.","source_refs":["v2-plan","v1-registry"],"depends_on":["V2-AUTH-002"],"implementation":["docs/project/M14_ENGINE_SOURCE_DECISION.md"],"test_ids":["V2-TEST-M14-SOURCE"],"evidence":["docs/project/M14_ENGINE_SOURCE_DECISION.md"]},
    {"id":"V2-AUTH-005","mandatory":true,"milestone":"M14","gate":"G14","status":"PASS","summary":"Every external-AI audit candidate is byte-locked with dependencies/licenses or truthfully rejected.","acceptance":"Ten indexed outcomes revalidate as eight locks and two retained rejections with no floating content identity.","source_refs":["v2-research","v2-baseline","v2-plan"],"depends_on":["V2-AUTH-003","V2-AUTH-004"],"implementation":["scripts/v2/acquire_ai_package.py","scripts/v2/validate_opponent_package_evidence.py","config/v2/opponent-package-evidence.json"],"test_ids":["V2-TEST-M14-PACKAGES"],"evidence":["docs/project/M14_OPPONENT_ACQUISITION.md","config/v2/opponent-package-evidence.json"]},
    {"id":"V2-AUTH-006","mandatory":true,"milestone":"M14","gate":"G14","status":"PASS","summary":"Every locked audit-pool AI receives an isolated runtime qualification outcome.","acceptance":"Pinned start, health, save/load, activity and resource-limit runs produce admission or machine rejection records.","source_refs":["v2-research","v2-plan"],"depends_on":["V2-AUTH-005"],"implementation":["scripts/v2/qualify_ai_runtime.py","scripts/v2/validate_opponent_runtime_evidence.py","config/v2/opponent-runtime-evidence.json"],"test_ids":["V2-TEST-M14-RUNTIME"],"evidence":["config/v2/opponent-runtime-evidence.json","docs/project/M14_OPPONENT_ACQUISITION.md"]},
    {"id":"V2-AUTH-007","mandatory":true,"milestone":"M14","gate":"G14","status":"PASS","summary":"Competition manifests freeze slots, delays, seeds, scenarios, settings and scoring before results.","acceptance":"Schema and mutations reject privilege asymmetry, missing runs, floating packages and post-result selection.","source_refs":["v2-research","v2-settings","v2-plan"],"depends_on":["V2-AUTH-006"],"implementation":["config/v2/m14-competition-manifest.json","docs/project/schema/v2-competition-manifest.schema.json","scripts/v2/validate_competition_manifest.py"],"test_ids":["V2-TEST-G14"],"evidence":["config/v2/m14-competition-manifest.json","docs/project/M14_INVENTORY_AND_COMPETITION.md"]},
    {"id":"V2-AUTH-008","mandatory":true,"milestone":"M14","gate":"G14","status":"PASS","summary":"The complete V1 traceability and regression suite remains mandatory in V2.","acceptance":"The V2 verifier executes the unchanged V1 traceability entrypoint and propagates any failure.","source_refs":["v1-registry","v2-plan"],"depends_on":["V2-AUTH-001"],"implementation":["scripts/v2/verify.sh"],"test_ids":["V2-TEST-V1-REGRESSION"],"evidence":["docs/project/G13_GATE_REPORT.md"]},

    {"id":"V2-SCALE-001","mandatory":true,"milestone":"M15","gate":"G15","status":"PASS","summary":"Native maps support every side length from 64 through 4096 and V1 32 compatibility.","acceptance":"Reset tests cover the 49 native rectangles, curriculum/generalization tiers and explicit boundary policy.","source_refs":["v2-research","v2-baseline","v2-plan","v2-m15"],"depends_on":["V2-AUTH-007"],"implementation":["config/v2/m15-scalable-contract.json","scripts/v2/validate_m15_scalable_contract.py","scripts/v2/qualify_m15_native_map.py","scripts/v2/run_m15_map_matrix.py","integration/openttd/patches/15.3/m15/0010-OpenTTD-RL-V2-M15-native-scalable-reset.patch","scripts/v2/qualify_m15_native_reset.py","scripts/v2/run_m15_native_reset_matrix.py"],"test_ids":["V2-TEST-M15-CONTRACT","V2-TEST-M15-MAPS","V2-TEST-M15-SOURCE","V2-TEST-M15-RESET","V2-TEST-G15"],"evidence":["config/v2/m15-scalable-contract.json","config/v2/m15-map-evidence.json","config/v2/m15-native-source.json","config/v2/m15-native-reset-evidence.json","config/v2/m15-native-reset-matrix.json","docs/project/M15_SCALABLE_CONTRACT.md"]},
    {"id":"V2-SCALE-002","mandatory":true,"milestone":"M15","gate":"G15","status":"PASS","summary":"Variable towns, industries, companies and entity pools obey measured resource bounds.","acceptance":"Boundary scenarios either run within frozen limits or fail before allocation with actionable diagnostics.","source_refs":["v2-research","v2-plan","v2-m15"],"depends_on":["V2-SCALE-001"],"implementation":["config/v2/m15-scalable-contract.json","scripts/v2/validate_m15_scalable_contract.py","scripts/v2/qualify_m15_native_map.py","scripts/v2/run_m15_map_matrix.py","integration/openttd/patches/15.3/m15/0010-OpenTTD-RL-V2-M15-native-scalable-reset.patch","scripts/v2/qualify_m15_native_reset.py","scripts/v2/run_m15_native_reset_matrix.py","scripts/v2/qualify_m15_observation.py"],"test_ids":["V2-TEST-M15-CONTRACT","V2-TEST-M15-MAPS","V2-TEST-M15-SOURCE","V2-TEST-M15-RESET","V2-TEST-M15-OBSERVATION","V2-TEST-G15"],"evidence":["config/v2/m15-scalable-contract.json","config/v2/m15-map-evidence.json","config/v2/m15-native-source.json","config/v2/m15-native-reset-evidence.json","config/v2/m15-native-reset-matrix.json","config/v2/m15-observation-evidence.json","docs/project/M15_SCALABLE_CONTRACT.md"]},
    {"id":"V2-SCALE-003","mandatory":true,"milestone":"M15","gate":"G15","status":"PASS","summary":"Observations include deterministic multi-resolution spatial tensors.","acceptance":"Independent native oracle matches channels, crops, padding, coordinate transforms and hashes across rectangular maps.","source_refs":["v2-plan","v2-m15","v1-registry"],"depends_on":["V2-SCALE-001"],"implementation":["config/v2/m15-scalable-contract.json","config/v2/m15-observation-contract.json","scripts/v2/validate_m15_scalable_contract.py","scripts/v2/validate_m15_observation_contract.py","integration/openttd/patches/15.3/m15/observation/0001-OpenTTD-RL-V2-M15-bounded-native-observation.patch","scripts/v2/qualify_m15_observation.py","scripts/v2/freeze_m15_observation_evidence.py"],"test_ids":["V2-TEST-M15-CONTRACT","V2-TEST-M15-OBSERVATION","V2-TEST-G15"],"evidence":["config/v2/m15-scalable-contract.json","config/v2/m15-observation-contract.json","config/v2/m15-observation-source.json","config/v2/m15-observation-evidence.json","docs/project/M15_SCALABLE_CONTRACT.md"]},